{
  "schema_version": 1,
  "worker_id": "unknown-instruction-investigator",
  "worker_snapshot_path": ".maestro/tasks/example/workers/unknown-instruction-investigator/spec.yaml",
  "objective": "Record that the required instruction cannot be resolved.",
  "completion_condition": "Stop before Worker execution and persist the unsupported requirement.",
  "instructions": {
    "required_refs": ["contract:unknown-required"],
    "optional_refs": [],
    "resolved": []
  },
  "context_refs": [{ "kind": "current-task", "path": ".maestro/tasks/example/context.md" }],
  "tools": [],
  "permissions": { "autonomous": [], "conditional": [] },
  "host_adapter": {
    "id": "example-host",
    "status": "unsupported",
    "unsupported_requirements": ["instruction:contract:unknown-required"]
  },
  "result_path": ".maestro/tasks/example/workers/unknown-instruction-investigator/runs/run-1/result.md",
  "handoff_path": ".maestro/tasks/example/handoffs/unknown-instruction-investigator-run-1.json"
}
