{
  "schema_version": 1,
  "worker_id": "bounded-investigator",
  "objective": "Investigate startup behavior.",
  "completion_condition": "Return evidence-backed findings and a standard Handoff.",
  "instructions": {
    "required_refs": ["contract:handoff", "policy:safety-boundary"],
    "optional_refs": [],
    "resolved": [
      {
        "ref": "policy:safety-boundary",
        "source_scope": "core",
        "source_paths": ["references/workers.md", "references/coordination.md"],
        "sha256": "b9e1ad15c9973662a2a8888e1fd926ae6e617d604db7b7df6e181e39a33baec9"
      }
    ]
  },
  "context_refs": [{ "kind": "current-task", "path": ".xiaotao/tasks/example/context.md" }],
  "tools": [],
  "permissions": { "autonomous": ["inspect-project"], "conditional": [] },
  "host_adapter": {
    "id": "limited-host",
    "status": "unsupported",
    "unsupported_requirements": ["instruction:contract:handoff"]
  },
  "result_path": ".xiaotao/tasks/example/workers/bounded-investigator/runs/run-2/result.md",
  "handoff_path": ".xiaotao/tasks/example/handoffs/bounded-investigator-run-2.json"
}
