{
  "schema_version": 1,
  "worker_id": "bounded-investigator",
  "worker_snapshot_path": ".xiaotao/tasks/example/workers/bounded-investigator/spec.yaml",
  "objective": "Determine why startup initialization is slow without modifying product code.",
  "completion_condition": "Return evidence-backed findings and a standard Handoff.",
  "instructions": {
    "required_refs": ["contract:handoff", "policy:safety-boundary"],
    "optional_refs": [],
    "resolved": [
      {
        "ref": "contract:handoff",
        "source_scope": "core",
        "source_paths": ["references/handoffs.md"],
        "sha256": "d32370997d5b1098b5f85eb39ef063beea0d6443b0acd4b8644559afb28f3517"
      },
      {
        "ref": "policy:safety-boundary",
        "source_scope": "core",
        "source_paths": ["references/workers.md", "references/coordination.md"],
        "sha256": "b9e1ad15c9973662a2a8888e1fd926ae6e617d604db7b7df6e181e39a33baec9"
      }
    ]
  },
  "context_refs": [
    { "kind": "current-task", "path": ".xiaotao/tasks/example/context.md" },
    { "kind": "relevant-evidence", "path": "src/startup.ts" }
  ],
  "tools": ["shell"],
  "permissions": {
    "autonomous": ["inspect-project", "run-nondestructive-checks", "write-work-artifacts"],
    "conditional": []
  },
  "host_adapter": {
    "id": "example-host",
    "status": "supported",
    "unsupported_requirements": []
  },
  "result_path": ".xiaotao/tasks/example/workers/bounded-investigator/runs/run-1/result.md",
  "handoff_path": ".xiaotao/tasks/example/handoffs/bounded-investigator-run-1.json"
}
