{
  "schema_version": 1,
  "worker_id": "bounded-investigator",
  "worker_snapshot_path": ".maestro/tasks/example/workers/bounded-investigator/spec.yaml",
  "objective": "Determine why startup initialization is slow without modifying product code.",
  "completion_condition": "Return evidence-backed findings and a standard Handoff.",
  "instructions": {
    "required_refs": ["contract:handoff", "policy:safety-boundary"],
    "optional_refs": [],
    "resolved": [
      {
        "ref": "contract:handoff",
        "source_scope": "core",
        "source_paths": ["references/handoffs.md"],
        "sha256": "fee6f99345414bbcf8534cf7875e2533e65f15d4cd1155b280dce6d5d079ae6f"
      },
      {
        "ref": "policy:safety-boundary",
        "source_scope": "core",
        "source_paths": ["references/workers.md", "references/coordination.md"],
        "sha256": "068751e781b88434bea9f2c31a091d2f4fadd9d3ad2a5d5baeebfe016d440fb7"
      }
    ]
  },
  "context_refs": [
    { "kind": "current-task", "path": ".maestro/tasks/example/context.md" },
    { "kind": "relevant-evidence", "path": "src/startup.ts" }
  ],
  "tools": ["shell"],
  "permissions": {
    "autonomous": ["inspect-project", "run-nondestructive-checks", "write-work-artifacts"],
    "conditional": []
  },
  "host_adapter": {
    "id": "example-host",
    "status": "supported",
    "unsupported_requirements": []
  },
  "result_path": ".maestro/tasks/example/workers/bounded-investigator/runs/run-1/result.md",
  "handoff_path": ".maestro/tasks/example/handoffs/bounded-investigator-run-1.json"
}
